{
  "runId": "20260805T125650135Z__L1-form-basic__f3d7376be3d94baaad4b2d363e6a1095",
  "caseId": "L1-form-basic",
  "tier": 1,
  "timestampUtc": "2026-08-05T12:56:50.137471+00:00",
  "source": "replay",
  "score": {
    "xppClean": true,
    "xppErrors": 0,
    "referencesClean": true,
    "referenceErrors": 0,
    "goldenMatch": true,
    "goldenDiff": {
      "missing": [],
      "extra": [],
      "changed": [],
      "isMatch": true
    }
  }
}