{
  "runId": "20260805T182451555Z__L2-datasource-method-basic__d3378ce6a4b440cca3178b55013b5e95",
  "caseId": "L2-datasource-method-basic",
  "tier": 2,
  "timestampUtc": "2026-08-05T18:24:51.5550452+00:00",
  "source": "replay",
  "score": {
    "xppClean": true,
    "xppErrors": 0,
    "referencesClean": true,
    "referenceErrors": 0,
    "goldenMatch": true,
    "goldenDiff": {
      "missing": [],
      "extra": [],
      "changed": [],
      "isMatch": true
    }
  },
  "note": "Phase 1.1: ObjectTypeRegistry; AxQuery abstract-root fix"
}