{
  "runId": "20260805T125757338Z__L2-enum-extension__098fd0d8199d4ca1a6c3f8db8711f0fd",
  "caseId": "L2-enum-extension",
  "tier": 2,
  "timestampUtc": "2026-08-05T12:57:57.3402194+00:00",
  "source": "replay",
  "score": {
    "xppClean": true,
    "xppErrors": 0,
    "referencesClean": true,
    "referenceErrors": 0,
    "goldenMatch": true,
    "goldenDiff": {
      "missing": [],
      "extra": [],
      "changed": [],
      "isMatch": true
    }
  }
}