{
  "runId": "20260805T180439632Z__L1-report-basic__92988471994c4815b0f4c886b49e6b85",
  "caseId": "L1-report-basic",
  "tier": 1,
  "timestampUtc": "2026-08-05T18:04:39.6325914+00:00",
  "source": "replay",
  "score": {
    "xppClean": true,
    "xppErrors": 0,
    "referencesClean": true,
    "referenceErrors": 0,
    "goldenMatch": true,
    "goldenDiff": {
      "missing": [],
      "extra": [],
      "changed": [],
      "isMatch": true
    }
  },
  "note": "Phase 0 gate: workflow AxWorkflowTemplate fix, form-pattern strictness, golden caption hygiene"
}