{
  "runId": "20260805T182434623Z__L1-form-simplelist-details__0fabf83a3e5d4f58a7b17a0b881e7456",
  "caseId": "L1-form-simplelist-details",
  "tier": 1,
  "timestampUtc": "2026-08-05T18:24:34.623295+00:00",
  "source": "replay",
  "score": {
    "xppClean": true,
    "xppErrors": 0,
    "referencesClean": true,
    "referenceErrors": 0,
    "goldenMatch": true,
    "goldenDiff": {
      "missing": [],
      "extra": [],
      "changed": [],
      "isMatch": true
    }
  },
  "note": "Phase 1.1: ObjectTypeRegistry; AxQuery abstract-root fix"
}