{
  "runId": "20260805T163204115Z__L2-security-duty-extension__deef047ab36a403bb4cec828c8b7a111",
  "caseId": "L2-security-duty-extension",
  "tier": 2,
  "timestampUtc": "2026-08-05T16:32:04.1172189+00:00",
  "source": "replay",
  "score": {
    "xppClean": true,
    "xppErrors": 0,
    "referencesClean": true,
    "referenceErrors": 0,
    "goldenMatch": true,
    "goldenDiff": {
      "missing": [],
      "extra": [],
      "changed": [],
      "isMatch": true
    }
  }
}