{
  "runId": "20260805T125807969Z__L2-numberseq-basic__f37292c7c6bb41f6b4b0c87bca85a75b",
  "caseId": "L2-numberseq-basic",
  "tier": 2,
  "timestampUtc": "2026-08-05T12:58:07.9716909+00:00",
  "source": "replay",
  "score": {
    "xppClean": true,
    "xppErrors": 0,
    "referencesClean": false,
    "referenceErrors": 4,
    "goldenMatch": true,
    "goldenDiff": {
      "missing": [],
      "extra": [],
      "changed": [],
      "isMatch": true
    }
  }
}