{
  "runId": "20260805T163147577Z__L2-datasource-method-basic__60ec255a4ded4b3cac898d02be93c2bc",
  "caseId": "L2-datasource-method-basic",
  "tier": 2,
  "timestampUtc": "2026-08-05T16:31:47.579178+00:00",
  "source": "replay",
  "score": {
    "xppClean": true,
    "xppErrors": 0,
    "referencesClean": true,
    "referenceErrors": 0,
    "goldenMatch": true,
    "goldenDiff": {
      "missing": [],
      "extra": [],
      "changed": [],
      "isMatch": true
    }
  }
}