{
  "runId": "20260805T180434188Z__L1-map-multi-table__41cf742ccfc34bdbb11f7a4a0aa43d7b",
  "caseId": "L1-map-multi-table",
  "tier": 1,
  "timestampUtc": "2026-08-05T18:04:34.1880444+00:00",
  "source": "replay",
  "score": {
    "xppClean": true,
    "xppErrors": 0,
    "referencesClean": true,
    "referenceErrors": 0,
    "goldenMatch": true,
    "goldenDiff": {
      "missing": [],
      "extra": [],
      "changed": [],
      "isMatch": true
    }
  },
  "note": "Phase 0 gate: workflow AxWorkflowTemplate fix, form-pattern strictness, golden caption hygiene"
}