{
  "runId": "20260805T163011819Z__L1-custom-service-basic__343eca84798d46588da57a6812f6e173",
  "caseId": "L1-custom-service-basic",
  "tier": 1,
  "timestampUtc": "2026-08-05T16:30:11.8213858+00:00",
  "source": "replay",
  "score": {
    "xppClean": true,
    "xppErrors": 0,
    "referencesClean": true,
    "referenceErrors": 0,
    "goldenMatch": true,
    "goldenDiff": {
      "missing": [],
      "extra": [],
      "changed": [],
      "isMatch": true
    }
  }
}