{
  "runId": "20260805T163142503Z__L2-coc-extension__c0d19e8fbcd9460b83a0a1a22dfd4b05",
  "caseId": "L2-coc-extension",
  "tier": 2,
  "timestampUtc": "2026-08-05T16:31:42.5055262+00:00",
  "source": "replay",
  "score": {
    "xppClean": true,
    "xppErrors": 0,
    "referencesClean": true,
    "referenceErrors": 0,
    "goldenMatch": true,
    "goldenDiff": {
      "missing": [],
      "extra": [],
      "changed": [],
      "isMatch": true
    }
  }
}