{
  "runId": "20260805T163029741Z__L1-form-list-page__390cfb9df89e4386baf525b79326097f",
  "caseId": "L1-form-list-page",
  "tier": 1,
  "timestampUtc": "2026-08-05T16:30:29.7437804+00:00",
  "source": "replay",
  "score": {
    "xppClean": true,
    "xppErrors": 0,
    "referencesClean": true,
    "referenceErrors": 0,
    "goldenMatch": true,
    "goldenDiff": {
      "missing": [],
      "extra": [],
      "changed": [],
      "isMatch": true
    }
  }
}