{
  "runId": "20260805T163038948Z__L1-form-table-of-contents__341ac2c6b38a472a84889e97f540a2a4",
  "caseId": "L1-form-table-of-contents",
  "tier": 1,
  "timestampUtc": "2026-08-05T16:30:38.9508288+00:00",
  "source": "replay",
  "score": {
    "xppClean": true,
    "xppErrors": 0,
    "referencesClean": true,
    "referenceErrors": 0,
    "goldenMatch": true,
    "goldenDiff": {
      "missing": [],
      "extra": [],
      "changed": [],
      "isMatch": true
    }
  }
}