{
  "runId": "20260805T144434280Z__L2-form-extension-basic__f5f24195fa86429eb9d26c8e4be2ca7d",
  "caseId": "L2-form-extension-basic",
  "tier": 2,
  "timestampUtc": "2026-08-05T14:44:34.2826829+00:00",
  "source": "replay",
  "score": {
    "xppClean": true,
    "xppErrors": 0,
    "referencesClean": true,
    "referenceErrors": 0,
    "goldenMatch": true,
    "goldenDiff": {
      "missing": [],
      "extra": [],
      "changed": [],
      "isMatch": true
    }
  }
}