{
  "runId": "20260805T182430472Z__L1-form-details-master__530b6fc4f40b4f659bfd7ba147df8ad8",
  "caseId": "L1-form-details-master",
  "tier": 1,
  "timestampUtc": "2026-08-05T18:24:30.4724814+00:00",
  "source": "replay",
  "score": {
    "xppClean": true,
    "xppErrors": 0,
    "referencesClean": true,
    "referenceErrors": 0,
    "goldenMatch": true,
    "goldenDiff": {
      "missing": [],
      "extra": [],
      "changed": [],
      "isMatch": true
    }
  },
  "note": "Phase 1.1: ObjectTypeRegistry; AxQuery abstract-root fix"
}