{
  "runId": "20260805T182441428Z__L1-privilege-data-entity__2d670eaa3d6f47fe9cfcd28985b6fe89",
  "caseId": "L1-privilege-data-entity",
  "tier": 1,
  "timestampUtc": "2026-08-05T18:24:41.4288033+00:00",
  "source": "replay",
  "score": {
    "xppClean": true,
    "xppErrors": 0,
    "referencesClean": true,
    "referenceErrors": 0,
    "goldenMatch": true,
    "goldenDiff": {
      "missing": [],
      "extra": [],
      "changed": [],
      "isMatch": true
    }
  },
  "note": "Phase 1.1: ObjectTypeRegistry; AxQuery abstract-root fix"
}