{
  "runId": "20260805T163009233Z__L1-class-basic__a1365e61885a44658642bc62c4796fd8",
  "caseId": "L1-class-basic",
  "tier": 1,
  "timestampUtc": "2026-08-05T16:30:09.235396+00:00",
  "source": "replay",
  "score": {
    "xppClean": true,
    "xppErrors": 0,
    "referencesClean": true,
    "referenceErrors": 0,
    "goldenMatch": true,
    "goldenDiff": {
      "missing": [],
      "extra": [],
      "changed": [],
      "isMatch": true
    }
  }
}